{
  "documentType": "field08_gate2c_external_capture_manifest",
  "schemaVersion": "1.0.0",
  "manifestId": "external_captures.field08_gate2c.v1",
  "status": "local_only_human_reuse_review_pending",
  "captures": [
    {
      "captureId": "capture.field08.no.landbruksdirektoratet-food-waste-2024",
      "sourceCandidateId": "field08.source.no.landbruksdirektoratet-food-waste-2024",
      "sourceUrl": "https://www.landbruksdirektoratet.no/nb/filarkiv/rapporter/Matsvinn%20i%20jordbrukssektoren%20Kartlegging%20for%202024%20Rapport%2045%202025.pdf",
      "accessedAt": "2026-07-28",
      "capturedAt": "2026-07-28T23:27:02+02:00",
      "localPath": "research/evidence-pack/field08-gate2c-2026-07-28/raw/no-landbruksdirektoratet-matsvinn-jordbrukssektoren-2024.pdf",
      "storageClass": "local_external",
      "archiveDurability": "local_only_at_risk",
      "recoveryLocator": "https://www.landbruksdirektoratet.no/nb/filarkiv/rapporter/Matsvinn%20i%20jordbrukssektoren%20Kartlegging%20for%202024%20Rapport%2045%202025.pdf",
      "sha256": "sha256:bc5a13497396ac8b919074f494cc5ae978140765bd31540f31ea24ccfa7521f2",
      "sizeBytes": 1145355,
      "mediaType": "application/pdf",
      "fileMagic": "%PDF-1.7",
      "redistributionStatus": "review_pending",
      "license": null,
      "licenseUrl": null,
      "inspectionNote": {
        "path": "research/evidence-pack/field08-gate2c-2026-07-28/notes/no-landbruksdirektoratet-matsvinn-jordbrukssektoren-2024.md",
        "sha256": "sha256:dcf9293e11aa135a5672054221029fc26e9c10e8aa1215a49b56276387168619",
        "sizeBytes": 2265,
        "mediaType": "text/markdown",
        "authorship": "project_authored",
        "scope": "bounded_facts_and_locator_metadata",
        "preparationMethod": "manual_factual_locator_note",
        "containsFullText": false,
        "containsVerbatimSourceText": false,
        "sourcePdfSha256": "sha256:bc5a13497396ac8b919074f494cc5ae978140765bd31540f31ea24ccfa7521f2",
        "rightsBoundary": "does_not_grant_source_redistribution_rights",
        "preparedAt": "2026-07-29"
      }
    },
    {
      "captureId": "capture.field08.ax.asub-waste-statistics-2024",
      "sourceCandidateId": "field08.source.ax.asub-waste-statistics-2024",
      "sourceUrl": "https://www.asub.ax/sites/default/files/media/document/avfall24.pdf",
      "accessedAt": "2026-07-28",
      "capturedAt": "2026-07-28T23:27:02+02:00",
      "localPath": "research/evidence-pack/field08-gate2c-2026-07-28/raw/ax-asub-avfallsstatistik-2024.pdf",
      "storageClass": "local_external",
      "archiveDurability": "local_only_at_risk",
      "recoveryLocator": "https://www.asub.ax/sites/default/files/media/document/avfall24.pdf",
      "sha256": "sha256:22bab6a3537fca2673ff82dc2de7fa8ecdd7b6f1938a08e6d43de33d199c5e7c",
      "sizeBytes": 831943,
      "mediaType": "application/pdf",
      "fileMagic": "%PDF-1.7",
      "redistributionStatus": "review_pending",
      "license": null,
      "licenseUrl": null,
      "inspectionNote": {
        "path": "research/evidence-pack/field08-gate2c-2026-07-28/notes/ax-asub-avfallsstatistik-2024.md",
        "sha256": "sha256:00c7ff299fcc4a58d18adf0af8ab196b3e12c6c85ae24f44269887d6bf153b8a",
        "sizeBytes": 2392,
        "mediaType": "text/markdown",
        "authorship": "project_authored",
        "scope": "bounded_facts_and_locator_metadata",
        "preparationMethod": "manual_factual_locator_note",
        "containsFullText": false,
        "containsVerbatimSourceText": false,
        "sourcePdfSha256": "sha256:22bab6a3537fca2673ff82dc2de7fa8ecdd7b6f1938a08e6d43de33d199c5e7c",
        "rightsBoundary": "does_not_grant_source_redistribution_rights",
        "preparedAt": "2026-07-29"
      }
    },
    {
      "captureId": "capture.field08.is.environment-agency-food-waste-2022",
      "sourceCandidateId": "field08.source.is.environment-agency-food-waste-2022",
      "sourceUrl": "https://www.umhverfisstofnun.is/library/Skrar/utgefid-efni/Annad/Food_waste_in_Iceland_2022_UPD.pdf",
      "accessedAt": "2026-07-28",
      "capturedAt": "2026-07-28T23:27:03+02:00",
      "localPath": "research/evidence-pack/field08-gate2c-2026-07-28/raw/is-environment-agency-food-waste-2022.pdf",
      "storageClass": "local_external",
      "archiveDurability": "local_only_at_risk",
      "recoveryLocator": "https://www.umhverfisstofnun.is/library/Skrar/utgefid-efni/Annad/Food_waste_in_Iceland_2022_UPD.pdf",
      "sha256": "sha256:07bf2d6b14b521cd1d1a94f62f116be6c34f784913c8a52910983717b28708ab",
      "sizeBytes": 1956559,
      "mediaType": "application/pdf",
      "fileMagic": "%PDF-1.7",
      "redistributionStatus": "review_pending",
      "license": null,
      "licenseUrl": null,
      "inspectionNote": {
        "path": "research/evidence-pack/field08-gate2c-2026-07-28/notes/is-environment-agency-food-waste-2022.md",
        "sha256": "sha256:29c0cd97ca823b46ec9859000d30b34b5fffc7dca96993e3874a9af4ae70aa7a",
        "sizeBytes": 2409,
        "mediaType": "text/markdown",
        "authorship": "project_authored",
        "scope": "bounded_facts_and_locator_metadata",
        "preparationMethod": "manual_factual_locator_note",
        "containsFullText": false,
        "containsVerbatimSourceText": false,
        "sourcePdfSha256": "sha256:07bf2d6b14b521cd1d1a94f62f116be6c34f784913c8a52910983717b28708ab",
        "rightsBoundary": "does_not_grant_source_redistribution_rights",
        "preparedAt": "2026-07-29"
      }
    }
  ]
}
